[
  {
    "id": "L1_single_standard_001",
    "difficulty": "L1",
    "tags": ["baseline"],
    "inputDraft": {
      "positions": [{ "id": "p1", "code": "5", "factor": 2.3, "count": 1 }],
      "context": { "setting": "ambulant", "specialty": "allgemein" }
    },
    "gold": {
      "expectedFindings": [],
      "expectedCorrectedDraft": { "positions": [{ "id": "p1", "code": "5", "factor": 2.3, "count": 1 }], "context": { "setting": "ambulant", "specialty": "allgemein" } },
      "expectedAmounts": { "positionAmounts": [{ "id": "p1", "amount": 10.72 }], "totalAmount": 10.72 },
      "requiredEvidence": { "mustHaveSourceRef": false, "mustIncludeLegalRefs": [] }
    }
  },
  {
    "id": "L1_high_factor_warn_002",
    "difficulty": "L1",
    "tags": ["faktor"],
    "inputDraft": {
      "positions": [{ "id": "p1", "code": "5", "factor": 2.8, "count": 1 }],
      "context": { "setting": "ambulant", "specialty": "allgemein" }
    },
    "gold": {
      "expectedFindings": [{ "category": "faktor", "severity": "warning", "codeRefs": ["5"] }],
      "expectedCorrectedDraft": { "positions": [{ "id": "p1", "code": "5", "factor": 2.8, "count": 1 }], "context": { "setting": "ambulant", "specialty": "allgemein" } },
      "expectedAmounts": { "positionAmounts": [{ "id": "p1", "amount": 13.05 }], "totalAmount": 13.05 },
      "requiredEvidence": { "mustHaveSourceRef": true, "mustIncludeLegalRefs": ["GOÄ §5"] }
    }
  },
  {
    "id": "L1_over_max_error_003",
    "difficulty": "L1",
    "tags": ["faktor", "hard-error"],
    "inputDraft": {
      "positions": [{ "id": "p1", "code": "1", "factor": 4.0, "count": 1 }],
      "context": { "setting": "ambulant", "specialty": "allgemein" }
    },
    "gold": {
      "expectedFindings": [{ "category": "faktor", "severity": "error", "codeRefs": ["1"] }],
      "expectedCorrectedDraft": { "positions": [{ "id": "p1", "code": "1", "factor": 3.5, "count": 1 }], "context": { "setting": "ambulant", "specialty": "allgemein" } },
      "expectedAmounts": { "positionAmounts": [{ "id": "p1", "amount": 9.79 }], "totalAmount": 9.79 },
      "requiredEvidence": { "mustHaveSourceRef": true, "mustIncludeLegalRefs": ["GOÄ §5"] }
    }
  },
  {
    "id": "L1_time_min_34_fail_004",
    "difficulty": "L1",
    "tags": ["zeit"],
    "inputDraft": {
      "positions": [{ "id": "p1", "code": "34", "factor": 2.3, "durationMin": 10 }],
      "context": { "setting": "ambulant", "specialty": "psycho" }
    },
    "gold": {
      "expectedFindings": [{ "category": "zeit", "severity": "error", "codeRefs": ["34"] }],
      "expectedCorrectedDraft": { "positions": [{ "id": "p1", "code": "34", "factor": 2.3, "durationMin": 10 }], "context": { "setting": "ambulant", "specialty": "psycho" } },
      "expectedAmounts": { "positionAmounts": [{ "id": "p1", "amount": 40.23 }], "totalAmount": 40.23 },
      "requiredEvidence": { "mustHaveSourceRef": true, "mustIncludeLegalRefs": ["Leistungslegende GOÄ-Ziffer"] }
    }
  },
  {
    "id": "L2_exclusion_1_3_001",
    "difficulty": "L2",
    "tags": ["ausschluss"],
    "inputDraft": {
      "positions": [
        { "id": "p1", "code": "1", "factor": 2.3 },
        { "id": "p2", "code": "3", "factor": 2.3 }
      ],
      "context": { "setting": "ambulant", "specialty": "allgemein" }
    },
    "gold": {
      "expectedFindings": [{ "category": "ausschluss", "severity": "error", "codeRefs": ["1", "3"] }],
      "expectedCorrectedDraft": { "positions": [{ "id": "p2", "code": "3", "factor": 2.3 }], "context": { "setting": "ambulant", "specialty": "allgemein" } },
      "expectedAmounts": { "positionAmounts": [{ "id": "p2", "amount": 20.11 }], "totalAmount": 20.11 },
      "requiredEvidence": { "mustHaveSourceRef": true, "mustIncludeLegalRefs": ["Ausschlussziffern GOÄ-Katalog"] }
    }
  },
  {
    "id": "L2_exclusion_1201_1202_002",
    "difficulty": "L2",
    "tags": ["ausschluss", "augenheilkunde"],
    "inputDraft": {
      "positions": [
        { "id": "p1", "code": "1201", "factor": 2.3 },
        { "id": "p2", "code": "1202", "factor": 2.3 }
      ],
      "context": { "setting": "ambulant", "specialty": "augenheilkunde" }
    },
    "gold": {
      "expectedFindings": [{ "category": "ausschluss", "severity": "error", "codeRefs": ["1201", "1202"] }],
      "expectedCorrectedDraft": { "positions": [{ "id": "p1", "code": "1201", "factor": 2.3 }], "context": { "setting": "ambulant", "specialty": "augenheilkunde" } },
      "expectedAmounts": { "positionAmounts": [{ "id": "p1", "amount": 13.15 }], "totalAmount": 13.15 },
      "requiredEvidence": { "mustHaveSourceRef": true, "mustIncludeLegalRefs": ["Ausschlussziffern GOÄ-Katalog"] }
    }
  },
  {
    "id": "L2_amount_mismatch_multi_003",
    "difficulty": "L2",
    "tags": ["rechenfehler"],
    "inputDraft": {
      "positions": [
        { "id": "p1", "code": "5", "factor": 2.3, "amountClaimed": 99.99 },
        { "id": "p2", "code": "1", "factor": 2.3, "amountClaimed": 12.22 }
      ],
      "context": { "setting": "ambulant", "specialty": "allgemein" }
    },
    "gold": {
      "expectedFindings": [
        { "category": "rechenfehler", "severity": "warning", "codeRefs": ["5"] },
        { "category": "rechenfehler", "severity": "warning", "codeRefs": ["1"] }
      ],
      "expectedCorrectedDraft": { "positions": [{ "id": "p1", "code": "5", "factor": 2.3 }, { "id": "p2", "code": "1", "factor": 2.3 }], "context": { "setting": "ambulant", "specialty": "allgemein" } },
      "expectedAmounts": { "positionAmounts": [{ "id": "p1", "amount": 10.72 }, { "id": "p2", "amount": 6.43 }], "totalAmount": 17.15 },
      "requiredEvidence": { "mustHaveSourceRef": true, "mustIncludeLegalRefs": [] }
    }
  },
  {
    "id": "L2_time_bundle_unrealistic_004",
    "difficulty": "L2",
    "tags": ["zeit", "plausibilitaet"],
    "inputDraft": {
      "positions": [
        { "id": "p1", "code": "30", "factor": 2.3, "durationMin": 300 },
        { "id": "p2", "code": "31", "factor": 2.3, "durationMin": 240 },
        { "id": "p3", "code": "34", "factor": 2.3, "durationMin": 220 }
      ],
      "context": { "setting": "ambulant", "specialty": "psycho" }
    },
    "gold": {
      "expectedFindings": [{ "category": "zeit", "severity": "warning", "codeRefs": ["30", "31", "34"] }],
      "expectedCorrectedDraft": { "positions": [{ "id": "p1", "code": "30", "factor": 2.3, "durationMin": 300 }, { "id": "p2", "code": "31", "factor": 2.3, "durationMin": 240 }, { "id": "p3", "code": "34", "factor": 2.3, "durationMin": 220 }], "context": { "setting": "ambulant", "specialty": "psycho" } },
      "expectedAmounts": { "positionAmounts": [{ "id": "p1", "amount": 120.34 }, { "id": "p2", "amount": 61.22 }, { "id": "p3", "amount": 40.23 }], "totalAmount": 221.79 },
      "requiredEvidence": { "mustHaveSourceRef": true, "mustIncludeLegalRefs": [] }
    }
  },
  {
    "id": "L3_zielleistung_bloodstopping_001",
    "difficulty": "L3",
    "tags": ["zielleistung", "op"],
    "inputDraft": {
      "positions": [{ "id": "p1", "code": "253", "factor": 2.3, "notes": "Blutstillung als Teilschritt der OP" }],
      "context": { "setting": "op", "specialty": "chirurgie" }
    },
    "gold": {
      "expectedFindings": [{ "category": "zielleistung", "severity": "error", "codeRefs": ["253"] }],
      "expectedCorrectedDraft": { "positions": [], "context": { "setting": "op", "specialty": "chirurgie" } },
      "expectedAmounts": { "positionAmounts": [], "totalAmount": 0 },
      "requiredEvidence": { "mustHaveSourceRef": true, "mustIncludeLegalRefs": ["GOÄ §4 Abs.2a", "GOÄ §6 Abs.2"] }
    }
  },
  {
    "id": "L3_conflict_chain_002",
    "difficulty": "L3",
    "tags": ["ausschluss", "multi"],
    "inputDraft": {
      "positions": [
        { "id": "p1", "code": "1", "factor": 2.3 },
        { "id": "p2", "code": "3", "factor": 2.3 },
        { "id": "p3", "code": "1201", "factor": 2.3 },
        { "id": "p4", "code": "1202", "factor": 2.3 }
      ],
      "context": { "setting": "ambulant", "specialty": "augenheilkunde" }
    },
    "gold": {
      "expectedFindings": [
        { "category": "ausschluss", "severity": "error", "codeRefs": ["1", "3"] },
        { "category": "ausschluss", "severity": "error", "codeRefs": ["1201", "1202"] }
      ],
      "expectedCorrectedDraft": { "positions": [{ "id": "p2", "code": "3", "factor": 2.3 }, { "id": "p3", "code": "1201", "factor": 2.3 }], "context": { "setting": "ambulant", "specialty": "augenheilkunde" } },
      "expectedAmounts": { "positionAmounts": [{ "id": "p2", "amount": 20.11 }, { "id": "p3", "amount": 13.15 }], "totalAmount": 33.26 },
      "requiredEvidence": { "mustHaveSourceRef": true, "mustIncludeLegalRefs": ["Ausschlussziffern GOÄ-Katalog"] }
    }
  },
  {
    "id": "L3_factor_time_combo_003",
    "difficulty": "L3",
    "tags": ["faktor", "zeit", "mixed"],
    "inputDraft": {
      "positions": [
        { "id": "p1", "code": "34", "factor": 2.8, "durationMin": 12 },
        { "id": "p2", "code": "1", "factor": 4.0, "durationMin": 5 }
      ],
      "context": { "setting": "ambulant", "specialty": "psycho" }
    },
    "gold": {
      "expectedFindings": [
        { "category": "zeit", "severity": "error", "codeRefs": ["34"] },
        { "category": "faktor", "severity": "warning", "codeRefs": ["34"] },
        { "category": "faktor", "severity": "error", "codeRefs": ["1"] }
      ],
      "expectedCorrectedDraft": { "positions": [{ "id": "p1", "code": "34", "factor": 2.8, "durationMin": 12 }, { "id": "p2", "code": "1", "factor": 3.5, "durationMin": 5 }], "context": { "setting": "ambulant", "specialty": "psycho" } },
      "expectedAmounts": { "positionAmounts": [{ "id": "p1", "amount": 48.97 }, { "id": "p2", "amount": 9.79 }], "totalAmount": 58.76 },
      "requiredEvidence": { "mustHaveSourceRef": true, "mustIncludeLegalRefs": ["GOÄ §5", "Leistungslegende GOÄ-Ziffer"] }
    }
  },
  {
    "id": "L3_stationary_time_overload_004",
    "difficulty": "L3",
    "tags": ["zeit", "stationaer"],